problem_data/normal/normal_k1.5_instance_004.json

{
  "machines": 3,
  "jobs": [
    [
      [
        {
          "machine": 1,
          "processing": 2.453
        },
        {
          "machine": 0,
          "processing": 1.886
        }
      ],
      [
        {
          "machine": 2,
          "processing": 2.301
        },
        {
          "machine": 0,
          "processing": 2.008
        }
      ],
      [
        {
          "machine": 0,
          "processing": 3.146
        }
      ],
      [
        {
          "machine": 0,
          "processing": 1.968
        }
      ]
    ],
    [
      [
        {
          "machine": 1,
          "processing": 3.364
        },
        {
          "machine": 2,
          "processing": 3.731
        },
        {
          "machine": 0,
          "processing": 3.832
        }
      ],
      [
        {
          "machine": 1,
          "processing": 1.382
        }
      ],
      [
        {
          "machine": 0,
          "processing": 3.235
        }
      ],
      [
        {
          "machine": 0,
          "processing": 1.081
        }
      ]
    ],
    [
      [
        {
          "machine": 2,
          "processing": 1.891
        },
        {
          "machine": 1,
          "processing": 2.38
        }
      ],
      [
        {
          "machine": 1,
          "processing": 1.381
        },
        {
          "machine": 2,
          "processing": 1.338
        },
        {
          "machine": 0,
          "processing": 1.166
        }
      ],
      [
        {
          "machine": 1,
          "processing": 1.004
        }
      ]
    ],
    [
      [
        {
          "machine": 0,
          "processing": 5.682
        },
        {
          "machine": 2,
          "processing": 5.429
        },
        {
          "machine": 1,
          "processing": 4.315
        }
      ],
      [
        {
          "machine": 0,
          "processing": 2.818
        },
        {
          "machine": 1,
          "processing": 3.298
        }
      ]
    ],
    [
      [
        {
          "machine": 0,
          "processing": 2.043
        },
        {
          "machine": 1,
          "processing": 2.249
        }
      ],
      [
        {
          "machine": 0,
          "processing": 1.118
        }
      ],
      [
        {
          "machine": 0,
          "processing": 4.998
        },
        {
          "machine": 1,
          "processing": 4.209
        },
        {
          "machine": 2,
          "processing": 4.033
        }
      ],
      [
        {
          "machine": 2,
          "processing": 1.183
        }
      ]
    ],
    [
      [
        {
          "machine": 2,
          "processing": 1.462
        },
        {
          "machine": 0,
          "processing": 1.728
        }
      ],
      [
        {
          "machine": 0,
          "processing": 3.824
        },
        {
          "machine": 1,
          "processing": 4.434
        }
      ],
      [
        {
          "machine": 1,
          "processing": 4.386
        },
        {
          "machine": 0,
          "processing": 3.344
        },
        {
          "machine": 2,
          "processing": 3.363
        }
      ]
    ],
    [
      [
        {
          "machine": 0,
          "processing": 1.238
        }
      ],
      [
        {
          "machine": 2,
          "processing": 3.55
        },
        {
          "machine": 1,
          "processing": 3.199
        }
      ],
      [
        {
          "machine": 1,
          "processing": 3.67
        }
      ],
      [
        {
          "machine": 1,
          "processing": 3.539
        }
      ]
    ],
    [
      [
        {
          "machine": 2,
          "processing": 4.766
        },
        {
          "machine": 0,
          "processing": 5.158
        },
        {
          "machine": 1,
          "processing": 4.53
        }
      ],
      [
        {
          "machine": 1,
          "processing": 3.218
        }
      ],
      [
        {
          "machine": 2,
          "processing": 4.591
        },
        {
          "machine": 0,
          "processing": 5.314
        }
      ]
    ],
    [
      [
        {
          "machine": 1,
          "processing": 3.219
        },
        {
          "machine": 2,
          "processing": 2.674
        },
        {
          "machine": 0,
          "processing": 2.91
        }
      ],
      [
        {
          "machine": 0,
          "processing": 3.494
        }
      ]
    ],
    [
      [
        {
          "machine": 2,
          "processing": 4.656
        }
      ],
      [
        {
          "machine": 0,
          "processing": 4.016
        },
        {
          "machine": 1,
          "processing": 3.804
        },
        {
          "machine": 2,
          "processing": 3.349
        }
      ]
    ],
    [
      [
        {
          "machine": 0,
          "processing": 3.647
        }
      ],
      [
        {
          "machine": 1,
          "processing": 1.365
        }
      ],
      [
        {
          "machine": 0,
          "processing": 2.301
        },
        {
          "machine": 1,
          "processing": 1.942
        }
      ]
    ],
    [
      [
        {
          "machine": 0,
          "processing": 2.371
        },
        {
          "machine": 2,
          "processing": 2.672
        }
      ],
      [
        {
          "machine": 0,
          "processing": 3.208
        },
        {
          "machine": 1,
          "processing": 3.942
        }
      ],
      [
        {
          "machine": 0,
          "processing": 4.407
        },
        {
          "machine": 1,
          "processing": 4.313
        }
      ],
      [
        {
          "machine": 2,
          "processing": 1.863
        },
        {
          "machine": 1,
          "processing": 2.339
        },
        {
          "machine": 0,
          "processing": 2.409
        }
      ]
    ],
    [
      [
        {
          "machine": 2,
          "processing": 3.176
        },
        {
          "machine": 1,
          "processing": 2.667
        },
        {
          "machine": 0,
          "processing": 3.121
        }
      ],
      [
        {
          "machine": 0,
          "processing": 4.531
        },
        {
          "machine": 1,
          "processing": 3.87
        }
      ]
    ],
    [
      [
        {
          "machine": 2,
          "processing": 1.202
        },
        {
          "machine": 0,
          "processing": 1.196
        }
      ],
      [
        {
          "machine": 1,
          "processing": 2.621
        },
        {
          "machine": 0,
          "processing": 2.712
        }
      ],
      [
        {
          "machine": 0,
          "processing": 2.693
        }
      ],
      [
        {
          "machine": 0,
          "processing": 3.541
        },
        {
          "machine": 1,
          "processing": 3.74
        }
      ]
    ],
    [
      [
        {
          "machine": 0,
          "processing": 4.518
        }
      ],
      [
        {
          "machine": 2,
          "processing": 2.44
        }
      ]
    ],
    [
      [
        {
          "machine": 2,
          "processing": 0.957
        }
      ],
      [
        {
          "machine": 2,
          "processing": 3.07
        }
      ],
      [
        {
          "machine": 2,
          "processing": 1.314
        }
      ]
    ]
  ],
  "release_times": {
    "0": 0.0,
    "1": 0.0,
    "2": 0.0,
    "3": 0.0,
    "4": 0.0,
    "5": 0.0,
    "6": 0.0,
    "7": 0.0,
    "8": 0.0,
    "9": 0.0,
    "10": 0.0,
    "11": 0.0,
    "12": 0.0,
    "13": 0.0,
    "14": 0.0,
    "15": 0.0,
    "16": 2.706,
    "17": 1.972,
    "18": 2.475,
    "19": 12.355,
    "20": 23.688,
    "21": 1.088,
    "22": 18.803,
    "23": 14.289,
    "24": 2.658
  },
  "due_dates": {
    "0": 14,
    "1": 14,
    "2": 6,
    "3": 12,
    "4": 13,
    "5": 14,
    "6": 17,
    "7": 19,
    "8": 9,
    "9": 12,
    "10": 10,
    "11": 18,
    "12": 10,
    "13": 15,
    "14": 10,
    "15": 8,
    "16": 20,
    "17": 12,
    "18": 14,
    "19": 31,
    "20": 35,
    "21": 19,
    "22": 36,
    "23": 24,
    "24": 10
  },
  "tightness_factor": 1.5,
  "scale": "normal",
  "simulation_horizon": 55.517,
  "dynamic_events": [
    {
      "timestamp": 1.088,
      "event_type": "Job_Arrival",
      "data": {
        "job_id": 21,
        "operations": [
          [
            {
              "machine": 2,
              "processing": 5.54
            },
            {
              "machine": 0,
              "processing": 4.836
            },
            {
              "machine": 1,
              "processing": 5.045
            }
          ],
          [
            {
              "machine": 1,
              "processing": 2.141
            },
            {
              "machine": 0,
              "processing": 2.284
            }
          ],
          [
            {
              "machine": 1,
              "processing": 5.071
            }
          ]
        ],
        "release_time": 1.088,
        "due_date": 19,
        "is_emergency": false
      }
    },
    {
      "timestamp": 1.972,
      "event_type": "Job_Arrival",
      "data": {
        "job_id": 17,
        "operations": [
          [
            {
              "machine": 0,
              "processing": 2.146
            },
            {
              "machine": 1,
              "processing": 1.947
            },
            {
              "machine": 2,
              "processing": 1.714
            }
          ],
          [
            {
              "machine": 0,
              "processing": 4.077
            }
          ],
          [
            {
              "machine": 0,
              "processing": 1.32
            }
          ]
        ],
        "release_time": 1.972,
        "due_date": 12,
        "is_emergency": false
      }
    },
    {
      "timestamp": 2.475,
      "event_type": "Job_Arrival",
      "data": {
        "job_id": 18,
        "operations": [
          [
            {
              "machine": 2,
              "processing": 3.728
            },
            {
              "machine": 1,
              "processing": 4.833
            },
            {
              "machine": 0,
              "processing": 4.689
            }
          ],
          [
            {
              "machine": 1,
              "processing": 1.075
            }
          ],
          [
            {
              "machine": 0,
              "processing": 2.268
            },
            {
              "machine": 1,
              "processing": 3.127
            },
            {
              "machine": 2,
              "processing": 2.811
            }
          ]
        ],
        "release_time": 2.475,
        "due_date": 14,
        "is_emergency": false
      }
    },
    {
      "timestamp": 2.658,
      "event_type": "Emergency_Job_Arrival",
      "data": {
        "job_id": 24,
        "operations": [
          [
            {
              "machine": 1,
              "processing": 3.068
            },
            {
              "machine": 0,
              "processing": 2.514
            }
          ],
          [
            {
              "machine": 2,
              "processing": 4.378
            },
            {
              "machine": 1,
              "processing": 4.139
            }
          ]
        ],
        "release_time": 2.658,
        "due_date": 10,
        "is_emergency": true,
        "tightness_factor": 1.076
      }
    },
    {
      "timestamp": 2.706,
      "event_type": "Job_Arrival",
      "data": {
        "job_id": 16,
        "operations": [
          [
            {
              "machine": 1,
              "processing": 3.694
            }
          ],
          [
            {
              "machine": 0,
              "processing": 4.128
            },
            {
              "machine": 2,
              "processing": 3.948
            },
            {
              "machine": 1,
              "processing": 3.872
            }
          ],
          [
            {
              "machine": 1,
              "processing": 2.346
            },
            {
              "machine": 2,
              "processing": 2.069
            },
            {
              "machine": 0,
              "processing": 2.294
            }
          ],
          [
            {
              "machine": 2,
              "processing": 1.778
            },
            {
              "machine": 1,
              "processing": 1.49
            }
          ]
        ],
        "release_time": 2.706,
        "due_date": 20,
        "is_emergency": false
      }
    },
    {
      "timestamp": 12.355,
      "event_type": "Job_Arrival",
      "data": {
        "job_id": 19,
        "operations": [
          [
            {
              "machine": 0,
              "processing": 4.073
            },
            {
              "machine": 2,
              "processing": 4.551
            }
          ],
          [
            {
              "machine": 2,
              "processing": 3.482
            },
            {
              "machine": 0,
              "processing": 3.576
            }
          ],
          [
            {
              "machine": 0,
              "processing": 2.702
            }
          ],
          [
            {
              "machine": 0,
              "processing": 2.256
            },
            {
              "machine": 1,
              "processing": 1.976
            }
          ]
        ],
        "release_time": 12.355,
        "due_date": 31,
        "is_emergency": false
      }
    },
    {
      "timestamp": 14.289,
      "event_type": "Job_Arrival",
      "data": {
        "job_id": 23,
        "operations": [
          [
            {
              "machine": 1,
              "processing": 3.827
            },
            {
              "machine": 0,
              "processing": 3.305
            },
            {
              "machine": 2,
              "processing": 2.971
            }
          ],
          [
            {
              "machine": 0,
              "processing": 1.15
            },
            {
              "machine": 2,
              "processing": 1.004
            }
          ],
          [
            {
              "machine": 2,
              "processing": 2.626
            },
            {
              "machine": 0,
              "processing": 1.947
            },
            {
              "machine": 1,
              "processing": 2.628
            }
          ]
        ],
        "release_time": 14.289,
        "due_date": 24,
        "is_emergency": false
      }
    },
    {
      "timestamp": 18.803,
      "event_type": "Job_Arrival",
      "data": {
        "job_id": 22,
        "operations": [
          [
            {
              "machine": 2,
              "processing": 1.824
            },
            {
              "machine": 1,
              "processing": 1.854
            },
            {
              "machine": 0,
              "processing": 1.98
            }
          ],
          [
            {
              "machine": 0,
              "processing": 3.0
            },
            {
              "machine": 2,
              "processing": 2.811
            }
          ],
          [
            {
              "machine": 2,
              "processing": 3.592
            }
          ],
          [
            {
              "machine": 2,
              "processing": 3.709
            },
            {
              "machine": 1,
              "processing": 3.537
            },
            {
              "machine": 0,
              "processing": 3.52
            }
          ]
        ],
        "release_time": 18.803,
        "due_date": 36,
        "is_emergency": false
      }
    },
    {
      "timestamp": 23.688,
      "event_type": "Job_Arrival",
      "data": {
        "job_id": 20,
        "operations": [
          [
            {
              "machine": 1,
              "processing": 4.198
            },
            {
              "machine": 2,
              "processing": 3.979
            },
            {
              "machine": 0,
              "processing": 4.627
            }
          ],
          [
            {
              "machine": 0,
              "processing": 3.871
            }
          ]
        ],
        "release_time": 23.688,
        "due_date": 35,
        "is_emergency": false
      }
    },
    {
      "timestamp": 27.773,
      "event_type": "Machine_Breakdown",
      "data": {
        "machine_id": 2
      }
    },
    {
      "timestamp": 29.685,
      "event_type": "Machine_Repair",
      "data": {
        "machine_id": 2
      }
    },
    {
      "timestamp": 44.066,
      "event_type": "Machine_Breakdown",
      "data": {
        "machine_id": 1
      }
    },
    {
      "timestamp": 45.776,
      "event_type": "Machine_Repair",
      "data": {
        "machine_id": 1
      }
    }
  ],
  "metadata": {
    "seed": 260451,
    "dynamic_job_count": 8,
    "emergency_jobs_per_instance": 1,
    "machine_failure_probability": 0.5,
    "job_cancellation_probability": 0.0,
    "notes": "Due dates follow TWK. Horizon follows max(1.2*makespan_lb, 1.1*max_initial_due_date)."
  }
}

results/normal_ReflecMCTS/normal_k1.5_instance_004/interactions/iter2_Prior_Probabilities_222148.md

### Available Actions:

[
  {
    "index": "0",
    "job": 0,
    "op": 0,
    "machine": 1,
    "processing_time": 2.453,
    "start_time": 2.667,
    "wait_time": 2.667,
    "due_date": 14.0,
    "slack": 4.992,
    "is_critical": false
  },
  {
    "index": "1",
    "job": 0,
    "op": 0,
    "machine": 0,
    "processing_time": 1.886,
    "start_time": 0.0,
    "wait_time": 0.0,
    "due_date": 14.0,
    "slack": 4.992,
    "is_critical": false
  },
  {
    "index": "2",
    "job": 1,
    "op": 0,
    "machine": 1,
    "processing_time": 3.364,
    "start_time": 2.667,
    "wait_time": 2.667,
    "due_date": 14.0,
    "slack": 4.938,
    "is_critical": false
  },
  {
    "index": "3",
    "job": 1,
    "op": 0,
    "machine": 2,
    "processing_time": 3.731,
    "start_time": 4.766,
    "wait_time": 4.766,
    "due_date": 14.0,
    "slack": 4.938,
    "is_critical": false
  },
  {
    "index": "4",
    "job": 1,
    "op": 0,
    "machine": 0,
    "processing_time": 3.832,
    "start_time": 0.0,
    "wait_time": 0.0,
    "due_date": 14.0,
    "slack": 4.938,
    "is_critical": false
  },
  {
    "index": "5",
    "job": 2,
    "op": 0,
    "machine": 2,
    "processing_time": 1.891,
    "start_time": 4.766,
    "wait_time": 4.766,
    "due_date": 6.0,
    "slack": 1.939,
    "is_critical": false
  },
  {
    "index": "6",
    "job": 2,
    "op": 0,
    "machine": 1,
    "processing_time": 2.38,
    "start_time": 2.667,
    "wait_time": 2.667,
    "due_date": 6.0,
    "slack": 1.939,
    "is_critical": false
  },
  {
    "index": "7",
    "job": 3,
    "op": 0,
    "machine": 0,
    "processing_time": 5.682,
    "start_time": 0.0,
    "wait_time": 0.0,
    "due_date": 12.0,
    "slack": 4.867,
    "is_critical": false
  },
  {
    "index": "8",
    "job": 3,
    "op": 0,
    "machine": 2,
    "processing_time": 5.429,
    "start_time": 4.766,
    "wait_time": 4.766,
    "due_date": 12.0,
    "slack": 4.867,
    "is_critical": false
  },
  {
    "index": "9",
    "job": 3,
    "op": 0,
    "machine": 1,
    "processing_time": 4.315,
    "start_time": 2.667,
    "wait_time": 2.667,
    "due_date": 12.0,
    "slack": 4.867,
    "is_critical": false
  },
  {
    "index": "10",
    "job": 4,
    "op": 0,
    "machine": 0,
    "processing_time": 2.043,
    "start_time": 0.0,
    "wait_time": 0.0,
    "due_date": 13.0,
    "slack": 4.623,
    "is_critical": false
  },
  {
    "index": "11",
    "job": 4,
    "op": 0,
    "machine": 1,
    "processing_time": 2.249,
    "start_time": 2.667,
    "wait_time": 2.667,
    "due_date": 13.0,
    "slack": 4.623,
    "is_critical": false
  },
  {
    "index": "12",
    "job": 5,
    "op": 0,
    "machine": 2,
    "processing_time": 1.462,
    "start_time": 4.766,
    "wait_time": 4.766,
    "due_date": 14.0,
    "slack": 5.37,
    "is_critical": false
  },
  {
    "index": "13",
    "job": 5,
    "op": 0,
    "machine": 0,
    "processing_time": 1.728,
    "start_time": 0.0,
    "wait_time": 0.0,
    "due_date": 14.0,
    "slack": 5.37,
    "is_critical": false
  },
  {
    "index": "14",
    "job": 6,
    "op": 0,
    "machine": 0,
    "processing_time": 1.238,
    "start_time": 0.0,
    "wait_time": 0.0,
    "due_date": 17.0,
    "slack": 5.354,
    "is_critical": false
  },
  {
    "index": "15",
    "job": 8,
    "op": 0,
    "machine": 1,
    "processing_time": 3.219,
    "start_time": 2.667,
    "wait_time": 2.667,
    "due_date": 9.0,
    "slack": 2.832,
    "is_critical": false
  },
  {
    "index": "16",
    "job": 8,
    "op": 0,
    "machine": 2,
    "processing_time": 2.674,
    "start_time": 4.766,
    "wait_time": 4.766,
    "due_date": 9.0,
    "slack": 2.832,
    "is_critical": false
  },
  {
    "index": "17",
    "job": 8,
    "op": 0,
    "machine": 0,
    "processing_time": 2.91,
    "start_time": 0.0,
    "wait_time": 0.0,
    "due_date": 9.0,
    "slack": 2.832,
    "is_critical": false
  },
  {
    "index": "18",
    "job": 9,
    "op": 0,
    "machine": 2,
    "processing_time": 4.656,
    "start_time": 4.766,
    "wait_time": 4.766,
    "due_date": 12.0,
    "slack": 3.995,
    "is_critical": false
  },
  {
    "index": "19",
    "job": 10,
    "op": 0,
    "machine": 0,
    "processing_time": 3.647,
    "start_time": 0.0,
    "wait_time": 0.0,
    "due_date": 10.0,
    "slack": 3.046,
    "is_critical": false
  },
  {
    "index": "20",
    "job": 11,
    "op": 0,
    "machine": 0,
    "processing_time": 2.371,
    "start_time": 0.0,
    "wait_time": 0.0,
    "due_date": 18.0,
    "slack": 6.245,
    "is_critical": true
  },
  {
    "index": "21",
    "job": 11,
    "op": 0,
    "machine": 2,
    "processing_time": 2.672,
    "start_time": 4.766,
    "wait_time": 4.766,
    "due_date": 18.0,
    "slack": 6.245,
    "is_critical": true
  },
  {
    "index": "22",
    "job": 13,
    "op": 0,
    "machine": 2,
    "processing_time": 1.202,
    "start_time": 4.766,
    "wait_time": 4.766,
    "due_date": 15.0,
    "slack": 4.949,
    "is_critical": false
  },
  {
    "index": "23",
    "job": 13,
    "op": 0,
    "machine": 0,
    "processing_time": 1.196,
    "start_time": 0.0,
    "wait_time": 0.0,
    "due_date": 15.0,
    "slack": 4.949,
    "is_critical": false
  },
  {
    "index": "24",
    "job": 14,
    "op": 0,
    "machine": 0,
    "processing_time": 4.518,
    "start_time": 0.0,
    "wait_time": 0.0,
    "due_date": 10.0,
    "slack": 3.042,
    "is_critical": false
  },
  {
    "index": "25",
    "job": 15,
    "op": 0,
    "machine": 2,
    "processing_time": 0.957,
    "start_time": 4.766,
    "wait_time": 4.766,
    "due_date": 8.0,
    "slack": 2.659,
    "is_critical": false
  }
]